{
  "rock_vein_count": 6,
  "rock_vein_min_length": 10,
  "rock_vein_max_length": 22,
  "outcrop_count": 5,
  "outcrop_min_size": 6,
  "outcrop_max_size": 16,
  "outcrop_placement_attempts": 200,
  "outcrop_compactness": 0.7,
  "hazard_count": 5,
  "hazard_placement_attempts": 500,
  "tree_count": 40,
  "tree_placement_attempts": 1000,
  "tree_grove_count": 6,
  "tree_grove_radius": 5,
  "berry_bush_count": 8,
  "berry_bush_placement_attempts": 120,
  "berry_bush_grove_count": 5,
  "berry_bush_grove_radius": 4,
  "river_min_width": 6,
  "river_max_width": 12,
  "river_control_point_spacing": 24,
  "river_max_transversal_delta": 6,
  "water_count": 6,
  "water_placement_attempts": 500,
  "spawn_area_x": 2,
  "spawn_area_y": 2,
  "spawn_area_width": 6,
  "spawn_area_height": 6,
  "spawn_search_attempts": 300,
  "spawn_water_step_limit": 40,
  "spawn_food_step_limit": 40,
  "spawn_tree_step_limit": 50,
  "colonist_count": 3,
  "reference_width": 48,
  "reference_height": 48,
  "default_new_game_width": 256,
  "default_new_game_height": 256,
  "min_world_size": 16,
  "max_world_size": 512
}
